{
  "$schema": "http://json-schema.org/draft-07/schema#",
  "description": "Incident in the public status dashboard",
  "id": "/",
  "items": {
    "properties": {
      "affected_products": {
        "description": "List of products that were affected by this incident.",
        "items": {
          "description": "An affected product",
          "properties": {
            "current_title": {
              "description": "Current marketing display title of the product.",
              "type": "string"
            },
            "id": {
              "description": "Unique ID for the product. This field is stable.",
              "type": "string"
            },
            "title": {
              "description": "Title of the product. This field is unstable and could change without warning.",
              "type": "string"
            }
          },
          "type": "object"
        },
        "type": "array"
      },
      "begin": {
        "description": "Time in RFC3339 format when this incident started.",
        "type": "string"
      },
      "created": {
        "description": "Time RFC3339 format when the entry was created.",
        "type": "string"
      },
      "currently_affected_locations": {
        "description": "List of locations that are currently affected by this incident.",
        "items": {
          "description": "An affected location",
          "properties": {
            "id": {
              "description": "Unique ID for the location. This field is stable.",
              "type": "string"
            },
            "title": {
              "description": "Title of the location. This field is unstable and could change without warning.",
              "type": "string"
            }
          },
          "type": "object"
        },
        "type": "array"
      },
      "end": {
        "description": "Time RFC3339 format when this incident ended.",
        "type": "string"
      },
      "external_desc": {
        "description": "Summary for this incident.",
        "type": "string"
      },
      "id": {
        "description": "Unique identifier for this incident. This field is stable.",
        "type": "string"
      },
      "modified": {
        "description": "Time RFC3339 format when this incident is updated.",
        "type": "string"
      },
      "most_recent_update": {
        "description": "The most recent update for this incident.",
        "properties": {
          "created": {
            "type": "string"
          },
          "modified": {
            "type": "string"
          },
          "status": {
            "type": "string"
          },
          "text": {
            "type": "string"
          },
          "when": {
            "type": "string"
          }
        },
        "type": "object"
      },
      "number": {
        "description": "Deprecated, please use id instead. The number is a uint64 numeric unique identifier for this incident.",
        "type": "string"
      },
      "previously_affected_locations": {
        "description": "List of locations that were previously affected by this incident.",
        "items": {
          "description": "An affected location",
          "properties": {
            "id": {
              "description": "Unique ID for the location. This field is stable.",
              "type": "string"
            },
            "title": {
              "description": "Title of the location. This field is unstable and could change without warning.",
              "type": "string"
            }
          },
          "type": "object"
        },
        "type": "array"
      },
      "service_key": {
        "description": "Deprecated, use affected_products instead. Unique ID for the product affected by this incident.",
        "type": "string"
      },
      "service_name": {
        "description": "Deprecated, use affected_products instead. Name of the product affected by this incident.",
        "type": "string"
      },
      "severity": {
        "description": "The severity of this incident (high, medium).",
        "type": "string"
      },
      "status_impact": {
        "description": "Service level impact from this incident.",
        "type": "string"
      },
      "updates": {
        "items": {
          "properties": {
            "affected_locations": {
              "description": "List of locations that are affected at the time when the status update was posted.",
              "items": {
                "description": "An affected location",
                "properties": {
                  "id": {
                    "description": "Unique ID for the location. This field is stable.",
                    "type": "string"
                  },
                  "title": {
                    "description": "Title of the location. This field is unstable and could change without warning.",
                    "type": "string"
                  }
                },
                "type": "object"
              },
              "type": "array"
            },
            "created": {
              "description": "RFC3339-formatted time when this update was created.",
              "type": "string"
            },
            "modified": {
              "description": "RFC3339-formatted time when the status update was edited.",
              "type": "string"
            },
            "status": {
              "description": " Service status at the time this status update was posted.",
              "type": "string"
            },
            "text": {
              "description": "The content of the incident status update.",
              "type": "string"
            },
            "when": {
              "description": "RFC3339-formatted time when this update was created.",
              "type": "string"
            }
          },
          "type": "object"
        },
        "type": "array"
      },
      "uri": {
        "description": "URI for this incident on the Status Dashboard.",
        "type": "string"
      }
    },
    "type": "object"
  },
  "title": "Incidents",
  "type": "array"
}
