[
  {
    "affected_products": [
      {
        "current_title": "AlloyDB for PostgreSQL",
        "id": "fPovtKbaWN9UTepMm3kJ",
        "title": "AlloyDB for PostgreSQL"
      },
      {
        "current_title": "Apigee",
        "id": "9Y13BNFy4fJydvjdsN3X",
        "title": "Apigee"
      },
      {
        "current_title": "Cloud Filestore",
        "id": "jog4nyYkquiLeSK5s26q",
        "title": "Cloud Filestore"
      },
      {
        "current_title": "Cloud Run",
        "id": "9D7d2iNBQWN24zc1VamE",
        "title": "Cloud Run"
      },
      {
        "current_title": "Cloud Spanner",
        "id": "EcNGGUgBtBLrtm4mWvqC",
        "title": "Cloud Spanner"
      },
      {
        "current_title": "Google App Engine",
        "id": "kchyUtnkMHJWaAva8aYc",
        "title": "Google App Engine"
      },
      {
        "current_title": "Google BigQuery",
        "id": "9CcrhHUcFevXPSVaSxkf",
        "title": "Google BigQuery"
      },
      {
        "current_title": "Google Cloud Bigtable",
        "id": "LfZSuE3xdQU46YMFV5fy",
        "title": "Google Cloud Bigtable"
      },
      {
        "current_title": "Google Cloud Dataflow",
        "id": "T9bFoXPqG8w8g1YbWTKY",
        "title": "Google Cloud Dataflow"
      },
      {
        "current_title": "Google Cloud SQL",
        "id": "hV87iK5DcEXKgWU2kDri",
        "title": "Google Cloud SQL"
      },
      {
        "current_title": "Google Compute Engine",
        "id": "L3ggmi3Jy4xJmgodFA9K",
        "title": "Google Compute Engine"
      },
      {
        "current_title": "Google Kubernetes Engine",
        "id": "LCSbT57h59oR4W98NHuz",
        "title": "Google Kubernetes Engine"
      },
      {
        "current_title": "Hybrid Connectivity",
        "id": "5x6CGnZvSHQZ26KtxpK1",
        "title": "Hybrid Connectivity"
      },
      {
        "current_title": "Looker (Google Cloud core)",
        "id": "QEyA1YSaAS3rJS6O8wHp",
        "title": "Looker (Google Cloud core)"
      },
      {
        "current_title": "Virtual Private Cloud (VPC)",
        "id": "BSGtCUnz6ZmyajsjgTKv",
        "title": "Virtual Private Cloud (VPC)"
      }
    ],
    "begin": "2026-09-01T14:44:00+00:00",
    "created": "2026-09-01T16:03:12+00:00",
    "currently_affected_locations": [],
    "end": "2026-09-01T18:52:00+00:00",
    "external_desc": "Multiple products in us-central1-b are experiencing network service degradation.",
    "id": "J5ia5t9p3g9Q5Wi7r8Ev",
    "modified": "2026-09-10T21:20:16+00:00",
    "most_recent_update": {
      "affected_locations": [],
      "created": "2026-09-10T21:20:16+00:00",
      "modified": "2026-09-10T21:20:17+00:00",
      "status": "AVAILABLE",
      "text": "## Incident Report\n## Summary\nOn Tuesday, 1 September 2026, some customers in us-central1 experienced network service degradation and instance isolation for a duration of 4 hours and 11 minutes. To our customers whose businesses were impacted during this disruption, we sincerely apologize. This is not the level of quality and reliability we strive to offer you, and we are taking immediate steps to improve the platform’s performance and availability.\n## Root Cause\nThe event was triggered by the inadvertent physical disconnection of network fiber-optic cables during routine hardware maintenance. A technician was performing a scheduled capacity upgrade on data center routers that support a fraction of capacity in the us-central1-b zone and a small fraction of capacity in the us-central1-f zone.\nDuring the hands-on maintenance, optical fibers connecting the data center routers to the network fabric were unplugged and the optical transceivers were replaced with a transceiver that supports higher-density connectivity. This transceiver was not compatible with the transceivers still in place in the data center fabric, causing a loss of connectivity for each fiber.\nThe network is designed with redundant routers in separate data center rooms within the same building so that failure of one router does not interrupt service. The maintenance was intended to upgrade one router at a time over several days, with traffic diversions at each step and verification between steps that the network has returned to a fully-connected state.\nHowever, a procedural error in the manually orchestrated upgrade process caused the complete list of transceiver replacements across all routers to be issued to the technician without instructions to sequence the work one router at a time. The maintenance workflow also did not include the expected human and software verification steps for detecting unintended disruption.\nAs a result, the technician sequentially unplugged all fiber paths across the affected devices within 13 minutes. The speed and nature of the error prevented warnings of incorrect action from reaching the engineer before connectivity was lost. Additionally, a standing procedure to halt if light is detected on any fiber-optic cable after unplug was not followed.\nThis resulted in compute capacity in the impacted zone being isolated from the network. Customers were unable to reach their virtual machines, and those virtual machines could not establish connections outside their zone.\n## Remediation and Prevention\nThe issue was detected immediately by automated network loss monitoring systems as well as proactive probes, which rapidly engaged the network engineering and incident response teams.\nTo mitigate the immediate customer impact, engineering teams actively moved traffic away from the impacted infrastructure.\nConcurrently, hardware operations technicians on site identified the disconnected optical links and physically re-inserted the original optical transceivers. Once the physical links were fully restored, traffic flow rates normalized and the traffic was redirected back to return the capacity to service.\nGoogle is committed to preventing a repeat of this issue in the future and is completing the following actions:\n* Reinforce training in us-central1 region and globally around safe maintenance techniques, including the mandatory requirement to verify whether light is on every unplugged fiber.\n* Finish the migration of network upgrade workflows to a fully automatically sequenced orchestration system. Most common regional network workflows were completed in 2025, and zonal workflows are in progress.\n* Complete the deployment of work stop alerting for actions resulting in the unintended disconnection of live fiber cables in Google data centers.\n* Complete the deployment of the automated system that will move regional traffic away from faulty zones, reducing the time from approximately 19 minutes in this instance to around 5 minutes.\n## Detailed Description of Impact\nOn Tuesday, 1 September, from 07:41 to 11:52 US/Pacific, a portion of the us-central1-b and us-central1-f zones experienced severe network degradation and resource isolation.\n1. Multiple products affected: The network disruption to/from a portion of us-central1-b and us-central1-f zones impacted all zonal GCP Products for some customers in those zones.\n2. Regional impact: Regional products using capacity in the affected data center were affected until traffic diversions were fully in place at 08:00 US/Pacific. Google Kubernetes Engine and Cloud Run / Google App Engine had longer impacts, discussed below.\n3. Error rate: Traffic flow drop rates for resources hosted in the affected area reached 100% during the peak of the incident, resulting in unreachable virtual machines and elevated packet loss.\n**Affected Services and Features**\n* Google Compute Engine: Inability for users in the affected portion of us-central1-b and us-central1-f zones to access virtual machines externally, and inability for VMs to reach remote resources.\n* Cloud SQL, AlloyDB for PostgreSQL, Google Cloud Bigtable, Cloud Filestore: Data access and connectivity severed for instances localized strictly to the impacted infrastructure.\n* Cloud Spanner, Cloud Firestore: Elevated Remote Procedure Call (RPC) error rates, write timeouts, and latency spikes for the nam5 multi-region instances due to severed connectivity to components running in the impacted zone.\n* Virtual Private Cloud (VPC), Cloud NAT, Apigee, Google BigQuery, Google Cloud Dataflow, Looker, Google SecOps SOAR, Hybrid Connectivity, Cloud Interconnect: Elevated network packet loss, connectivity drops, and API timeouts in the impacted zone.\n* Google Kubernetes Engine (GKE): Between 07:40 and 09:15 US/Pacific on 2026-09-01, customers experienced errors and timeouts on requests to their GKE cluster control planes (Kubernetes API servers) in us-central1. This could have caused new or updated workloads to fail scheduling and Kubernetes API operations to fail.\n* Cloud Run / Google App Engine: Temporary latency spikes and pending queue aborts as backend workloads automatically evacuated and shifted to healthy capacity. A subset of workloads in the specifically impacted area experienced degradation until 11:52 US/Pacific.\n**Customer Impact**\nCustomers with resources hosted in the specific affected clusters within us-central1-b and us-central1-f experienced a complete loss of network connectivity starting at 07:41 US/Pacific.\nDuring this time, virtual machines and associated services became unreachable from the internet and from other Google Cloud regions, and those internal resources could not initiate outbound connections.\nThe issue was detected almost immediately and engineers took traffic diversion actions at 07:45 and 08:00 US/Pacific to reduce impact to regional products.\nBy 08:50 US/Pacific, the majority of physical connections were restored and traffic began recovering, and the traffic diversion actions were removed at 09:19 US/Pacific.\nFull recovery across nearly all affected services and long-running operations was confirmed by 11:52 US/Pacific.\nBecause the network isolation was strictly limited to specific clusters within us-central1-b and us-central1-f, multi-zonal dep